{
  "website_url": "https://biasharaplus.com",
  "domain": "biasharaplus.com",
  "scraped_pages": [
    {
      "url": "https://biasharaplus.com",
      "title": "Biashara Plus, Online Price List",
      "headings": [
        "Your very own digital price list .",
        "ACCESS PRICE LIST FROM MORE THAN 8 COUNTRIES",
        "Request Biashara Plus to list your country."
      ],
      "paragraphs": [
        "Biashara is a Swahili word meaning Business; Biashara Plus is a well crafted and simple-to-use app that aims to help Forever Business Owners to access their products price list and removing all the go betweens that slows them down so they that can use the extra time to do some more biashara.",
        "Daily Users",
        "It Comes Fully Featured",
        "Biashara Plus is more than a digital pricelist, Biashara Plus Helps you with all your business operations so you can focus on your growth strategy.",
        "Pay Directly to Forever Living",
        "For South Africa, Namibia and Botswana, FBOs can pay directly to FLP Local Offices.",
        "Stay Up to date",
        "Be the first to get new price lists as soon as they come in wherever you are.",
        "Save time, order faster",
        "Just pick up the products and the calculations will be done for you.",
        "Set goals & achieve them",
        "With a history of your sales and purchases, you can easilly track your progress.",
        "Our Pricing",
        "Access Biashara Plus benefits for under 1 USD per month, subscription starts at 6 Months. With Eagle packages, you will have access to prices of your operating country and with super eagle, you will be able to access pricelist for all listed FLP countries",
        "Billed 6 Months",
        "Billed Anually",
        "One Country",
        "All Countries",
        "SOUTH AFRICA",
        "What our users says",
        "Over 10,000 Forever Living Business Owners in Africa have chosen Biashara Plus as their tool to simplify their business. Well dont take our word for it - read their reviews.",
        "The app is just fine on my side such that it's very quick and convenient, I give all the stars.",
        "Mercy Cherotich",
        "Trustworthy app, I ordered then the warehouse called to confirm for me same day",
        "Botsbeeable",
        "This is a very good app since you are able to order your own products with clear vision on what you buy for. Not only that , but also there are levels based on company policy.... Yaan ni raha sana kutumia hii app",
        "Good application indeed",
        "Prophet Peter",
        "I find it very convenient both for making orders and creating invoices for my customers. I can quickly calculate for my downline who feel they are too busy to make orders. I tell them to send the items they want and I send them the cost within minutes. This makes everyone make an order. No calculator stress. It's a good product",
        "Thresa Phiri",
        "We have Built Biashara Plus to scale, it takes our team less than a week to setup and deploy the app in a new country, and all this at zero cost to Forever Living Product Local Office.",
        "Biashara Plus App, is bought to you by Tanzanias award-winning Software Development company, iPF Softwares, in partnership with Forever Living South Africa & East Africa.",
        "P O Box 42041, Dar Es Salaam, Tanzania, East Africa",
        "Tel: +255 679 516 178",
        "products@ipfsoftwares.com",
        "Privacy Policy"
      ],
      "links": [
        "https://biasharaplus.com/privacy_policy"
      ],
      "metadata": {
        "viewport": "width=device-width, initial-scale=1.0",
        "author": "Biashara Plus",
        "google-site-verification": "F33FZlGb_5RlXGBWwcN7Kh3it2IzBR5hjtct6n7gjBg",
        "title": "Biashara Plus, Online Price List",
        "description": "Biashara Plus is a well crafted and simple-to-use app that aims to help Forever Business Owners to access their products price list and removing all the go-betweens that slow them down so they can use the extra time to do some more biashara.",
        "og:url": "http://biashara-plus.com",
        "og:type": "website",
        "og:title": "Biashara Plus, Online Price List ",
        "og:description": "Biashara Plus is a well crafted and simple-to-use app that aims to help Forever Business Owners to access their products price list and removing all the go-betweens that slow them down so they can use the extra time to do some more biashara.",
        "og:image": "https://biasharaplus.com/img/sociallogo.jpg",
        "og:image:secure": "https://biasharaplus.com/img/sociallogo.jpg",
        "og:app_id": "322119618197953",
        "twitter:card": "summary_large_image",
        "twitter:site": "@iPFSoftwares",
        "twitter:title": "Biashara Plus, Online Price List",
        "twitter:image": "https://biasharaplus.com/img/sociallogo.jpg",
        "twitter:image:src": "https://biasharaplus.com/img/sociallogo.jpg",
        "twitter:description": "Biashara Plus is a well crafted and simple-to-use app that aims to help Forever Business Owners to access their products price list and removing all the go-betweens that slow them down so they can use the extra time to do some more biashara.",
        "robots": "index, follow",
        "theme-color": "#448fe9",
        "detectify-verification": "58b6894723479673bd8809e48cd416b2"
      },
      "scraped_at": "2026-02-03T15:10:21.286542",
      "word_count": 877,
      "text_content": "Biashara Plus, Online Price List Help Center Your very own digital price list . Biashara is a Swahili word meaning Business; Biashara Plus is a well crafted and simple-to-use app that aims to help Forever Business Owners to access their products price list and removing all the go betweens that slows them down so they that can use the extra time to do some more biashara. 20 K + Downloads 200 + Daily Users 9 + Countries ACCESS PRICE LIST FROM MORE THAN 8 COUNTRIES It Comes Fully Featured Biashara Plus is more than a digital pricelist, Biashara Plus Helps you with all your business operations so you can focus on your growth strategy. Pay Directly to Forever Living For South Africa, Namibia and Botswana, FBOs can pay directly to FLP Local Offices. Stay Up to date Be the first to get new price lists as soon as they come in wherever you are. Save time, order faster Just pick up the products and the calculations will be done for you. Set goals & achieve them With a history of your sales and purchases, you can easilly track your progress. Our Pricing Access Biashara Plus benefits for under 1 USD per month, subscription starts at 6 Months. With Eagle packages, you will have access to prices of your operating country and with super eagle, you will be able to access pricelist for all listed FLP countries Billed 6 Months Billed Anually One Country All Countries TANZANIA TZS KENYA KSH UGANDA UGX ZAMBIA ZK SOUTH AFRICA ZAR BOTSWANA BWP RWANDA RWF NAMIBIA NAD What our users says Over 10,000 Forever Living Business Owners in Africa have chosen Biashara Plus as their tool to simplify their business. Well dont take our word for it - read their reviews. The app is just fine on my side such that it's very quick and convenient, I give all the stars. Mercy Cherotich Trustworthy app, I ordered then the warehouse called to confirm for me same day Botsbeeable This is a very good app since you are able to order your own products with clear vision on what you buy for. Not only that , but also there are levels based on company policy.... Yaan ni raha sana kutumia hii app Abdu Rerg Good application indeed Prophet Peter I find it very convenient both for making orders and creating invoices for my customers. I can quickly calculate for my downline who feel they are too busy to make orders. I tell them to send the items they want and I send them the cost within minutes. This makes everyone make an order. No calculator stress. It's a good product Thresa Phiri Request Biashara Plus to list your country. We have Built Biashara Plus to scale, it takes our team less than a week to setup and deploy the app in a new country, and all this at zero cost to Forever Living Product Local Office. E-mail us: products@ipfsoftwares.com Select a country ... Algeria Angola Benin Botswana Burkina Faso Burundi Cameroon Cape Verde Central African Republic Chad Comoros Congo - Brazzaville Congo - Kinshasa Cte dIvoire Djibouti Egypt Equatorial Guinea Eritrea Ethiopia Gabon Gambia Ghana Guinea Guinea-Bissau Kenya Lesotho Liberia Libya Madagascar Malawi Mali Mauritania Mauritius Mayotte Morocco Mozambique Namibia Niger Nigeria Rwanda Runion Saint Helena Senegal Seychelles Sierra Leone Somalia South Africa Sudan Swaziland So Tom and Prncipe Tanzania Togo Tunisia Uganda Western Sahara Zambia Zimbabwe Anguilla Antigua and Barbuda Argentina Aruba Bahamas Barbados Belize Bermuda Bolivia Brazil British Virgin Islands Canada Cayman Islands Chile Colombia Costa Rica Cuba Dominica Dominican Republic Ecuador El Salvador Falkland Islands French Guiana Greenland Grenada Guadeloupe Guatemala Guyana Haiti Honduras Jamaica Martinique Mexico Montserrat Netherlands Antilles Nicaragua Panama Paraguay Peru Puerto Rico Saint Barthlemy Saint Kitts and Nevis Saint Lucia Saint Martin Saint Pierre and Miquelon Saint Vincent and the Grenadines Suriname Trinidad and Tobago Turks and Caicos Islands U.S. Virgin Islands United States Uruguay Venezuela Afghanistan Armenia Azerbaijan Bahrain Bangladesh Bhutan Brunei Cambodia China Georgia Hong Kong SAR China India Indonesia Iran Iraq Israel Japan Jordan Kazakhstan Kuwait Kyrgyzstan Laos Lebanon Macau SAR China Malaysia Maldives Mongolia Myanmar [Burma] Nepal Neutral Zone North Korea Oman Pakistan Palestinian Territories People's Democratic Republic of Yemen Philippines Qatar Saudi Arabia Singapore South Korea Sri Lanka Syria Taiwan Tajikistan Thailand Timor-Leste Turkey Turkmenistan United Arab Emirates Uzbekistan Vietnam Yemen Albania Andorra Austria Belarus Belgium Bosnia and Herzegovina Bulgaria Croatia Cyprus Czech Republic Denmark East Germany Estonia Faroe Islands Finland France Germany Gibraltar Greece Guernsey Hungary Iceland Ireland Isle of Man Italy Jersey Latvia Liechtenstein Lithuania Luxembourg Macedonia Malta Metropolitan France Moldova Monaco Montenegro Netherlands Norway Poland Portugal Romania Russia San Marino Serbia Serbia and Montenegro Slovakia Slovenia Spain Svalbard and Jan Mayen Sweden Switzerland Ukraine Union of Soviet Socialist Republics United Kingdom Vatican City land Islands American Samoa Antarctica Australia Bouvet Island British Indian Ocean Territory Christmas Island Cocos [Keeling] Islands Cook Islands Fiji French Polynesia French Southern Territories Guam Heard Island and McDonald Islands Kiribati Marshall Islands Micronesia Nauru New Caledonia New Zealand Niue Norfolk Island Northern Mariana Islands Palau Papua New Guinea Pitcairn Islands Samoa Solomon Islands South Georgia and the South Sandwich Islands Tokelau Tonga Tuvalu U.S. Minor Outlying Islands Vanuatu Wallis and Futuna Send Request"
    },
    {
      "url": "https://biasharaplus.com/privacy_policy",
      "title": "Biashara Plus, Online Price List",
      "headings": [
        "Privacy Policy .",
        "Interpretation and Definitions",
        "Collecting and Using Your Personal Data",
        "Children's Privacy",
        "Links to Other Websites",
        "Changes to this Privacy Policy",
        "Interpretation",
        "Definitions",
        "Types of Data Collected:",
        "Use of Your Personal Data",
        "Retention of Your Personal Data",
        "Transfer of Your Personal Data",
        "Disclosure of Your Personal Data",
        "Security of Your Personal Data",
        "Personal Data",
        "Usage Data",
        "Business Transactions",
        "Law enforcement",
        "Other legal requirements"
      ],
      "paragraphs": [
        "Last updated: August 29, 2022",
        "This Privacy Policy describes Our policies and procedures on the collection, use and disclosure of Your information when You use the Service and tells You about Your privacy rights and how the law protects You.",
        "We use Your Personal data to provide and improve the Service. By using the Service, You agree to the collection and use of information in accordance with this Privacy Policy.",
        "The words of which the initial letter is capitalized have meanings defined under the following conditions. The following definitions shall have the same meaning regardless of whether they appear in singular or in plural.",
        "For the purposes of this Privacy Policy:",
        "Account means a unique account created for You to access our Service or parts of our Service.",
        "Affiliate means an entity that controls, is controlled by or is under common control with a party, where \"control\" means ownership of 50% or more of the shares, equity interest or other securities entitled to vote for election of directors or other managing authority.",
        "Application means the software program provided by the Company downloaded by You on any electronic device, named Biashara Plus",
        "Company (referred to as either \"the Company\", \"We\", \"Us\" or \"Our\" in this Agreement) refers to ICT PFIXERS CO LTD, Dar Es Salaam, Tanzania, Kinondoni 0092.",
        "Country refers to: Tanzania",
        "Device means any device that can access the Service such as a computer, a cellphone or a digital tablet.",
        "Personal Data is any information that relates to an identified or identifiable individual.",
        "Service refers to the Application.",
        "Service Provider means any natural or legal person who processes the data on behalf of the Company. It refers to third-party companies or individuals employed by the Company to facilitate the Service, to provide the Service on behalf of the Company, to perform services related to the Service or to assist the Company in analyzing how the Service is used.",
        "Usage Data refers to data collected automatically, either generated by the use of the Service or from the Service infrastructure itself (for example, the duration of a page visit).",
        "You means the individual accessing or using the Service, or the company, or other legal entity on behalf of which such individual is accessing or using the Service, as applicable.",
        "While using Our Service, We may ask You to provide Us with certain personally identifiable information that can be used to contact or identify You. Personally identifiable information may include, but is not limited to:",
        "Email address",
        "Phone number",
        "Usage Data is collected automatically when using the Service.",
        "Usage Data may include information such as Your Device's Internet Protocol address (e.g. IP address), browser type, browser version, the pages of our Service that You visit, the time and date of Your visit, the time spent on those pages, unique device identifiers and other diagnostic data.",
        "When You access the Service by or through a mobile device, We may collect certain information automatically, including, but not limited to, the type of mobile device You use, Your mobile operating system, unique device identifiers and other diagnostic data.",
        "The Company may use Personal Data for the following purposes:",
        "To provide and maintain our Service, including to monitor the usage of our Service.",
        "To manage Your Account: to manage Your registration as a user of the Service. The Personal Data You provide can give You access to different functionalities of the Service that are available to You as a registered user.",
        "For the performance of a contract: the development, compliance and undertaking of the purchase contract for the products, items or services You have purchased or of any other contract with Us through the Service.",
        "To contact You: To contact You by email, telephone calls, SMS, or other equivalent forms of electronic communication, such as a mobile application's push notifications regarding updates or informative communications related to the functionalities, products or contracted services, including the security updates, when necessary or reasonable for their implementation.",
        "To provide You with news, special offers and general information about other goods, services and events which we offer that are similar to those that you have already purchased or enquired about unless You have opted not to receive such information.",
        "To manage Your requests: To attend and manage Your requests to Us.",
        "For business transfers: We may use Your information to evaluate or conduct a merger, divestiture, restructuring, reorganization, dissolution, or other sale or transfer of some or all of Our assets, whether as a going concern or as part of bankruptcy, liquidation, or similar proceeding, in which Personal Data held by Us about our Service users is among the assets transferred.",
        "For other purposes: We may use Your information for other purposes, such as data analysis, identifying usage trends, determining the effectiveness of our promotional campaigns and to evaluate and improve our Service, products, services, marketing and your experience.",
        "We may share Your personal information in the following situations:",
        "The Company will retain Your Personal Data only for as long as is necessary for the purposes set out in this Privacy Policy. We will retain and use Your Personal Data to the extent necessary to comply with our legal obligations (for example, if we are required to retain your data to comply with applicable laws), resolve disputes, and enforce our legal agreements and policies.",
        "The Company will also retain Usage Data for internal analysis purposes. Usage Data is generally retained for a shorter period of time, except when this data is used to strengthen the security or to improve the functionality of Our Service, or We are legally obligated to retain this data for longer time periods.",
        "Your information, including Personal Data, is processed at the Company's operating offices and in any other places where the parties involved in the processing are located. It means that this information may be transferred to  and maintained on  computers located outside of Your state, province, country or other governmental jurisdiction where the data protection laws may differ than those from Your jurisdiction.",
        "Your consent to this Privacy Policy followed by Your submission of such information represents Your agreement to that transfer.",
        "The Company will take all steps reasonably necessary to ensure that Your data is treated securely and in accordance with this Privacy Policy and no transfer of Your Personal Data will take place to an organization or a country unless there are adequate controls in place including the security of Your data and other personal information.",
        "If the Company is involved in a merger, acquisition or asset sale, Your Personal Data may be transferred. We will provide notice before Your Personal Data is transferred and becomes subject to a different Privacy Policy.",
        "Under certain circumstances, the Company may be required to disclose Your Personal Data if required to do so by law or in response to valid requests by public authorities (e.g. a court or a government agency).",
        "The Company may disclose Your Personal Data in the good faith belief that such action is necessary to:",
        "The security of Your Personal Data is important to Us, but remember that no method of transmission over the Internet, or method of electronic storage is 100% secure. While We strive to use commercially acceptable means to protect Your Personal Data, We cannot guarantee its absolute security.",
        "Our Service does not address anyone under the age of 13. We do not knowingly collect personally identifiable information from anyone under the age of 13. If You are a parent or guardian and You are aware that Your child has provided Us with Personal Data, please contact Us. If We become aware that We have collected Personal Data from anyone under the age of 13 without verification of parental consent, We take steps to remove that information from Our servers.",
        "If We need to rely on consent as a legal basis for processing Your information and Your country requires consent from a parent, We may require Your parent's consent before We collect and use that information.",
        "Our Service may contain links to other websites that are not operated by Us. If You click on a third party link, You will be directed to that third party's site. We strongly advise You to review the Privacy Policy of every site You visit.",
        "We have no control over and assume no responsibility for the content, privacy policies or practices of any third party sites or services.",
        "We may update Our Privacy Policy from time to time. We will notify You of any changes by posting the new Privacy Policy on this page.",
        "We will let You know via email and/or a prominent notice on Our Service, prior to the change becoming effective and update the \"Last updated\" date at the top of this Privacy Policy.",
        "You are advised to review this Privacy Policy periodically for any changes. Changes to this Privacy Policy are effective when they are posted on this page.",
        "Biashara Plus App, is bought to you by Tanzanias award-winning Software Development company, iPF Softwares, in partnership with Forever Living South Africa & East Africa.",
        "P O Box 42041, Dar Es Salaam, Tanzania, East Africa",
        "Tel: +255 679 516 178",
        "products@ipfsoftwares.com",
        "Privacy Policy"
      ],
      "links": [
        "https://biasharaplus.com/privacy_policy"
      ],
      "metadata": {
        "viewport": "width=device-width, initial-scale=1.0",
        "author": "Biashara Plus",
        "google-site-verification": "F33FZlGb_5RlXGBWwcN7Kh3it2IzBR5hjtct6n7gjBg",
        "title": "Biashara Plus, Online Price List",
        "description": "Biashara Plus is a well crafted and simple-to-use app that aims to help Forever Business Owners to access their products price list and removing all the go-betweens that slow them down so they can use the extra time to do some more biashara.",
        "og:url": "http://biashara-plus.com",
        "og:type": "website",
        "og:title": "Biashara Plus, Online Price List ",
        "og:description": "Biashara Plus is a well crafted and simple-to-use app that aims to help Forever Business Owners to access their products price list and removing all the go-betweens that slow them down so they can use the extra time to do some more biashara.",
        "og:image": "https://biasharaplus.com/img/sociallogo.jpg",
        "og:image:secure": "https://biasharaplus.com/img/sociallogo.jpg",
        "og:app_id": "322119618197953",
        "twitter:card": "summary_large_image",
        "twitter:site": "@iPFSoftwares",
        "twitter:title": "Biashara Plus, Online Price List",
        "twitter:image": "https://biasharaplus.com/img/sociallogo.jpg",
        "twitter:image:src": "https://biasharaplus.com/img/sociallogo.jpg",
        "twitter:description": "Biashara Plus is a well crafted and simple-to-use app that aims to help Forever Business Owners to access their products price list and removing all the go-betweens that slow them down so they can use the extra time to do some more biashara.",
        "robots": "index, follow",
        "theme-color": "#448fe9",
        "detectify-verification": "58b6894723479673bd8809e48cd416b2"
      },
      "scraped_at": "2026-02-03T15:10:22.652856",
      "word_count": 1744,
      "text_content": "Biashara Plus, Online Price List Privacy Policy . Last updated: August 29, 2022 This Privacy Policy describes Our policies and procedures on the collection, use and disclosure of Your information when You use the Service and tells You about Your privacy rights and how the law protects You. We use Your Personal data to provide and improve the Service. By using the Service, You agree to the collection and use of information in accordance with this Privacy Policy. Interpretation and Definitions Interpretation The words of which the initial letter is capitalized have meanings defined under the following conditions. The following definitions shall have the same meaning regardless of whether they appear in singular or in plural. Definitions For the purposes of this Privacy Policy: Account means a unique account created for You to access our Service or parts of our Service. Affiliate means an entity that controls, is controlled by or is under common control with a party, where \"control\" means ownership of 50% or more of the shares, equity interest or other securities entitled to vote for election of directors or other managing authority. Application means the software program provided by the Company downloaded by You on any electronic device, named Biashara Plus Company (referred to as either \"the Company\", \"We\", \"Us\" or \"Our\" in this Agreement) refers to ICT PFIXERS CO LTD, Dar Es Salaam, Tanzania, Kinondoni 0092. Country refers to: Tanzania Device means any device that can access the Service such as a computer, a cellphone or a digital tablet. Personal Data is any information that relates to an identified or identifiable individual. Service refers to the Application. Service Provider means any natural or legal person who processes the data on behalf of the Company. It refers to third-party companies or individuals employed by the Company to facilitate the Service, to provide the Service on behalf of the Company, to perform services related to the Service or to assist the Company in analyzing how the Service is used. Usage Data refers to data collected automatically, either generated by the use of the Service or from the Service infrastructure itself (for example, the duration of a page visit). You means the individual accessing or using the Service, or the company, or other legal entity on behalf of which such individual is accessing or using the Service, as applicable. Collecting and Using Your Personal Data Types of Data Collected: Personal Data While using Our Service, We may ask You to provide Us with certain personally identifiable information that can be used to contact or identify You. Personally identifiable information may include, but is not limited to: Email address Username Phone number Usage Data Usage Data Usage Data is collected automatically when using the Service. Usage Data may include information such as Your Device's Internet Protocol address (e.g. IP address), browser type, browser version, the pages of our Service that You visit, the time and date of Your visit, the time spent on those pages, unique device identifiers and other diagnostic data. When You access the Service by or through a mobile device, We may collect certain information automatically, including, but not limited to, the type of mobile device You use, Your mobile operating system, unique device identifiers and other diagnostic data. Use of Your Personal Data The Company may use Personal Data for the following purposes: To provide and maintain our Service , including to monitor the usage of our Service. To manage Your Account: to manage Your registration as a user of the Service. The Personal Data You provide can give You access to different functionalities of the Service that are available to You as a registered user. For the performance of a contract: the development, compliance and undertaking of the purchase contract for the products, items or services You have purchased or of any other contract with Us through the Service. To contact You: To contact You by email, telephone calls, SMS, or other equivalent forms of electronic communication, such as a mobile application's push notifications regarding updates or informative communications related to the functionalities, products or contracted services, including the security updates, when necessary or reasonable for their implementation. To provide You with news, special offers and general information about other goods, services and events which we offer that are similar to those that you have already purchased or enquired about unless You have opted not to receive such information. To manage Your requests: To attend and manage Your requests to Us. For business transfers: We may use Your information to evaluate or conduct a merger, divestiture, restructuring, reorganization, dissolution, or other sale or transfer of some or all of Our assets, whether as a going concern or as part of bankruptcy, liquidation, or similar proceeding, in which Personal Data held by Us about our Service users is among the assets transferred. For other purposes : We may use Your information for other purposes, such as data analysis, identifying usage trends, determining the effectiveness of our promotional campaigns and to evaluate and improve our Service, products, services, marketing and your experience. We may share Your personal information in the following situations: With Service Providers: We may share Your personal information with Service Providers to monitor and analyze the use of our Service, to contact You. For business transfers: We may share or transfer Your personal information in connection with, or during negotiations of, any merger, sale of Company assets, financing, or acquisition of all or a portion of Our business to another company. With Affiliates: We may share Your information with Our affiliates, in which case we will require those affiliates to honor this Privacy Policy. Affiliates include Our parent company and any other subsidiaries, joint venture partners or other companies that We control or that are under common control with Us. With business partners: We may share Your information with Our business partners to offer You certain products, services or promotions. With Your consent : We may disclose Your personal information for any other purpose with Your consent. Retention of Your Personal Data The Company will retain Your Personal Data only for as long as is necessary for the purposes set out in this Privacy Policy. We will retain and use Your Personal Data to the extent necessary to comply with our legal obligations (for example, if we are required to retain your data to comply with applicable laws), resolve disputes, and enforce our legal agreements and policies. The Company will also retain Usage Data for internal analysis purposes. Usage Data is generally retained for a shorter period of time, except when this data is used to strengthen the security or to improve the functionality of Our Service, or We are legally obligated to retain this data for longer time periods. Transfer of Your Personal Data Your information, including Personal Data, is processed at the Company's operating offices and in any other places where the parties involved in the processing are located. It means that this information may be transferred to  and maintained on  computers located outside of Your state, province, country or other governmental jurisdiction where the data protection laws may differ than those from Your jurisdiction. Your consent to this Privacy Policy followed by Your submission of such information represents Your agreement to that transfer. The Company will take all steps reasonably necessary to ensure that Your data is treated securely and in accordance with this Privacy Policy and no transfer of Your Personal Data will take place to an organization or a country unless there are adequate controls in place including the security of Your data and other personal information. Disclosure of Your Personal Data Business Transactions If the Company is involved in a merger, acquisition or asset sale, Your Personal Data may be transferred. We will provide notice before Your Personal Data is transferred and becomes subject to a different Privacy Policy. Law enforcement Under certain circumstances, the Company may be required to disclose Your Personal Data if required to do so by law or in response to valid requests by public authorities (e.g. a court or a government agency). Other legal requirements The Company may disclose Your Personal Data in the good faith belief that such action is necessary to: Comply with a legal obligation Protect and defend the rights or property of the Company Prevent or investigate possible wrongdoing in connection with the Service Protect the personal safety of Users of the Service or the public Protect against legal liability Security of Your Personal Data The security of Your Personal Data is important to Us, but remember that no method of transmission over the Internet, or method of electronic storage is 100% secure. While We strive to use commercially acceptable means to protect Your Personal Data, We cannot guarantee its absolute security. Children's Privacy Our Service does not address anyone under the age of 13. We do not knowingly collect personally identifiable information from anyone under the age of 13. If You are a parent or guardian and You are aware that Your child has provided Us with Personal Data, please contact Us. If We become aware that We have collected Personal Data from anyone under the age of 13 without verification of parental consent, We take steps to remove that information from Our servers. If We need to rely on consent as a legal basis for processing Your information and Your country requires consent from a parent, We may require Your parent's consent before We collect and use that information. Links to Other Websites Our Service may contain links to other websites that are not operated by Us. If You click on a third party link, You will be directed to that third party's site. We strongly advise You to review the Privacy Policy of every site You visit. We have no control over and assume no responsibility for the content, privacy policies or practices of any third party sites or services. Changes to this Privacy Policy We may update Our Privacy Policy from time to time. We will notify You of any changes by posting the new Privacy Policy on this page. We will let You know via email and/or a prominent notice on Our Service, prior to the change becoming effective and update the \"Last updated\" date at the top of this Privacy Policy. You are advised to review this Privacy Policy periodically for any changes. Changes to this Privacy Policy are effective when they are posted on this page."
    }
  ],
  "total_word_count": 2621,
  "created_at": "2026-02-03T15:10:23.653645",
  "metadata": {
    "total_pages": 2,
    "visited_urls": 2,
    "max_pages_limit": 100000,
    "delay_between_requests": 1.0
  }
}